<?xml version="1.0" encoding="UTF-8"?>
<!--
  -  Copyright 2001-2008 Geert Bevin <gbevin[remove] at uwyn dot com>
  -  Licensed under the Apache License, Version 2.0 (the "License")
  -  $Id: scheduler.dtd 3918 2008-04-14 17:35:35Z gbevin $
  -  PUBLIC ID: -//Rifers.org//RIFE Scheduler 1.0//EN
  -  SYSTEM ID: http://rifers.org/dtd/scheduler_1_0.dtd
  -->

<!ELEMENT scheduler	(task*,executor*)>

<!ELEMENT task		(option)*>
<!ATTLIST task		classname NMTOKEN #IMPLIED
					planned CDATA #IMPLIED
					frequency CDATA #IMPLIED
					type CDATA #IMPLIED>
					
<!ELEMENT option	(#PCDATA | config)*>
<!ATTLIST option	name CDATA #REQUIRED>

<!ELEMENT executor	EMPTY>
<!ATTLIST executor	classname NMTOKEN #IMPLIED>

<!ELEMENT config	EMPTY>
<!ATTLIST config	param CDATA #REQUIRED>

